{
  "schema": "fenix.package-group.v1",
  "name": "t7-aml-source-app-stack",
  "selectors": {
    "boards": ["TVPRO", "VIM4"],
    "distributions": ["Ubuntu", "Debian", "Streambox"],
    "releases": ["jammy", "noble", "bookworm"],
    "image_types": ["server", "gnome"],
    "install_types": ["EMMC", "SD-USB"]
  },
  "include": [],
  "recipes": [
    "android-liblog",
    "android-binder",
    "aml-avsync",
    "aml-audio-utils",
    "libexpat1",
    "aml-audio-hal",
    "aml-audio-service",
    "aml-tvserver-streambox"
  ],
  "distro_packages": [],
  "notes": "Source-built Amlogic app dependency stack migrated from legacy package.mk recipes. libexpat1 is included as a source-built sysroot provider for aml-audio-hal until distro development package extraction is wired into the recipe runner."
}
