{
  "schema": "fenix.package-group.v1",
  "name": "t7-kernel-modules",
  "selectors": {
    "boards": ["TVPRO", "VIM4"],
    "distributions": ["Ubuntu", "Debian"],
    "releases": ["jammy", "noble", "bookworm"],
    "image_types": ["server", "gnome"],
    "install_types": ["EMMC", "SD-USB"]
  },
  "include": [],
  "recipes": ["vfm-cap"],
  "distro_packages": ["kmod"],
  "notes": "Initial source-built out-of-tree kernel module package group for T7 images."
}
